{
  "schema_version": "2.0.0",
  "kind": "kdna-current-index",
  "updated": "2026-09-10T07:21:58.772Z",
  "repository": "https://github.com/aikdna/kdna-assets",
  "listing_policy": "AIKDNA reference display only. Listing does not imply endorsement, correctness, quality, expertise, protocol approval, or official truth.",
  "assets": [
    {
      "kind": "kdna-asset",
      "id": "@aikdna/laozi-wuwei",
      "publisher": {
        "name": "AIKDNA",
        "url": "https://aikdna.com"
      },
      "creator": {
        "name": "OpenAI Codex agent"
      },
      "access": "public",
      "license": {
        "id": "CC-BY-4.0",
        "path": "references/public/laozi-wuwei/LICENSE",
        "scope": "asset-content-and-distribution",
        "repository_license_applies": false
      },
      "version": "0.1.1",
      "digest": {
        "algorithm": "sha256",
        "value": "4a90b91fe955ec3a563a7c2b598568f0eedbd04d3393211692490dfde2e09ffc"
      },
      "artifact": {
        "path": "references/public/laozi-wuwei/laozi-wuwei-0.1.1.kdna",
        "media_type": "application/vnd.kdna.asset"
      },
      "evidence_claims": [],
      "files": [
        {
          "path": "references/public/laozi-wuwei/LICENSE",
          "bytes": 13608,
          "sha256": "1dae4c7f400af505f6d478adeaee87129b3f2585cc93f1dcc441d6d1287f5f47"
        },
        {
          "path": "references/public/laozi-wuwei/README.md",
          "bytes": 2898,
          "sha256": "7067a0876035b4f004a974a90333fcff4205348c307f974148e29fca394db301"
        },
        {
          "path": "references/public/laozi-wuwei/laozi-wuwei-0.1.0.kdna",
          "bytes": 14605,
          "sha256": "ea0de0950b0217fb9421aa65c2d3d775fb5857efe18a93e82df52cda1815f924"
        },
        {
          "path": "references/public/laozi-wuwei/laozi-wuwei-0.1.0.kdna.sha256",
          "bytes": 89,
          "sha256": "b2542f67a3f8bf695231d7e62e95ec6e855649dd65ba85e5012ed93f7604a16b"
        },
        {
          "path": "references/public/laozi-wuwei/laozi-wuwei-0.1.1.kdna",
          "bytes": 14700,
          "sha256": "4a90b91fe955ec3a563a7c2b598568f0eedbd04d3393211692490dfde2e09ffc"
        },
        {
          "path": "references/public/laozi-wuwei/laozi-wuwei-0.1.1.kdna.sha256",
          "bytes": 89,
          "sha256": "b27a80fd95cf5f6e2a2fdf9e89a26e124791c9e3e028562e2f8ad326d05292f1"
        }
      ],
      "observation": {
        "checked_at": "2026-09-10T07:21:58.772Z",
        "method": "public_cli",
        "core": {
          "status": "rejected",
          "reason": "READ_CORE_INVALID"
        },
        "read": {
          "channel": "read_envelope",
          "status": "rejected",
          "diagnostics": [
            "READ_CORE_INVALID"
          ],
          "read_permission": "not_evaluated",
          "delivery": "not_delivered"
        },
        "scope": "exact bytes and explicitly permitted local observation; permission is not transferable"
      },
      "publication_status": "existing_reference",
      "proof_limits": {
        "creation": "not_evaluated",
        "identity": "not_evaluated",
        "action_authorization": "not_evaluated",
        "legal_clearance": "not_evaluated"
      }
    },
    {
      "kind": "kdna-asset",
      "id": "@aikdna/epictetus-control-and-character",
      "publisher": {
        "name": "AIKDNA",
        "url": "https://aikdna.com"
      },
      "creator": {
        "name": "OpenAI Codex agent"
      },
      "access": "public",
      "license": {
        "id": "CC-BY-4.0",
        "path": "references/public/epictetus-control-and-character/LICENSE",
        "scope": "asset-content-and-distribution",
        "repository_license_applies": false
      },
      "version": "0.1.1",
      "digest": {
        "algorithm": "sha256",
        "value": "d8513486bc033523359b8a582ca5d879d5ec01c926601d2fde34813a793c5ccf"
      },
      "artifact": {
        "path": "references/public/epictetus-control-and-character/epictetus-control-and-character-0.1.1.kdna",
        "media_type": "application/vnd.kdna.asset"
      },
      "evidence_claims": [],
      "files": [
        {
          "path": "references/public/epictetus-control-and-character/LICENSE",
          "bytes": 13608,
          "sha256": "1dae4c7f400af505f6d478adeaee87129b3f2585cc93f1dcc441d6d1287f5f47"
        },
        {
          "path": "references/public/epictetus-control-and-character/README.md",
          "bytes": 3072,
          "sha256": "66cfd7d4301bcd4f4409018899975598ea9cab92ab2f940450b89b00219aa3e4"
        },
        {
          "path": "references/public/epictetus-control-and-character/epictetus-control-and-character-0.1.0.kdna",
          "bytes": 15118,
          "sha256": "04da31b0e7deb66eded8d55d369692504c013196ee644a75fc9460b9c0d1a800"
        },
        {
          "path": "references/public/epictetus-control-and-character/epictetus-control-and-character-0.1.0.kdna.sha256",
          "bytes": 109,
          "sha256": "99494551526a180f3128d8d03cfa7520dbbde5120e5bf3ee11bb393e83f432b8"
        },
        {
          "path": "references/public/epictetus-control-and-character/epictetus-control-and-character-0.1.1.kdna",
          "bytes": 15197,
          "sha256": "d8513486bc033523359b8a582ca5d879d5ec01c926601d2fde34813a793c5ccf"
        },
        {
          "path": "references/public/epictetus-control-and-character/epictetus-control-and-character-0.1.1.kdna.sha256",
          "bytes": 109,
          "sha256": "9880b7dae2471c691b1e4a2ab874de411da3e5a8768946bfb7162010bc37d873"
        }
      ],
      "observation": {
        "checked_at": "2026-09-10T07:21:58.772Z",
        "method": "public_cli",
        "core": {
          "status": "rejected",
          "reason": "READ_CORE_INVALID"
        },
        "read": {
          "channel": "read_envelope",
          "status": "rejected",
          "diagnostics": [
            "READ_CORE_INVALID"
          ],
          "read_permission": "not_evaluated",
          "delivery": "not_delivered"
        },
        "scope": "exact bytes and explicitly permitted local observation; permission is not transferable"
      },
      "publication_status": "existing_reference",
      "proof_limits": {
        "creation": "not_evaluated",
        "identity": "not_evaluated",
        "action_authorization": "not_evaluated",
        "legal_clearance": "not_evaluated"
      }
    }
  ],
  "clusters": [],
  "toolchain_binding_sha256": "b3ffd99249836c16ef75a13d33cfd80f678bdacc02d424141719a7089c533475"
}
