{
  "schema_version": "2.0.0",
  "kind": "kdna-current-index",
  "updated": "2026-10-27T15:12:20Z",
  "repository": "https://github.com/aikdna/kdna-assets",
  "listing_policy": "AIKDNA reference display only. Listing does not imply endorsement, correctness, quality, expertise, protocol approval, or official truth.",
  "assets": [],
  "clusters": [],
  "toolchain_binding_sha256": "c48a4721942f1161ba4bf124152c8966a31553492b9737e867da07bb3ece7a0b"
}
